,Unnamed: 0.1,Unnamed: 0,links,names,ratings,price for two,cuisine,area,final_reviews,area_list,cuisine_list
130,130,130,https://www.zomato.com/bangalore/inanna-tap-room-bannerghatta-road-bangalore,Inanna Tap Room,4.3,"₹2,000 for two",chinese north indian burger pizza italian desserts,bannerghatta,lightings yummy dishes courteous staffs customizable dishes recommend place best services expertise ambience family din,Bannerghatta,"Chinese, North Indian, Burger, Pizza, Italian, Desserts"
131,131,131,https://www.zomato.com/bangalore/you-mee-malleshwaram-bangalore,You Mee,4.4,"₹2,200 for two",asian sushi japanese chinese desserts beverages,malleshwaram,good food good ambience japanese cuisine comfortable seating area beautiful view super service good large groups indoor outdoor ambience good service great,Malleshwaram,"Asian, Sushi, Japanese, Chinese, Desserts, Beverages"
132,132,132,https://www.zomato.com/bangalore/ishaara-kr-puram-bangalore,Ishaara,4.5,"₹2,500 for two",north indian mughlai kebab biryani,whitefield,great concept unique experience warm service lovely service amazing vibe exceptional service family authentic,Whitefield,"North Indian, Mughlai, Kebab, Biryani"
133,133,133,https://www.zomato.com/bangalore/feast-sheraton-grand-bengaluru-whitefield-hotel-convention-centre-whitefield-bangalore,Feast - Sheraton Grand Bengaluru Whitefield Hotel & Convention Centre,4.3,"₹3,500 for two",continental south indian north indian desserts beverages,whitefield,cooking stations jazz music sophisticated worth price great hospitality best restaurant family restaurant,Whitefield,"Continental, South Indian, North Indian, Desserts, Beverages"
134,134,134,https://www.zomato.com/bangalore/jw-kitchen-jw-marriott-bengaluru-lavelle-road,JW Kitchen - JW Marriott Bengaluru,4.2,"₹5,000 for two",north indian continental mughlai beverages desserts,lavelleroad,coconut mousse seafood salad lunch buffets mud pie crepes dessert counter family buffet,Lavelle Road,"North Indian, Continental, Mughlai, Beverages, Desserts"
135,135,135,https://www.zomato.com/bangalore/chilis-american-grill-bar-rajajinagar-bangalore,Chili's American Grill & Bar,4.3,"₹1,800 for two",continental mexican american italian desserts beverages,malleshwaram,quality quantity food great lake side view amazing food service love food love service wonderful view good ambience service good excellent service,Malleshwaram,"Continental, Mexican, American, Italian, Desserts, Beverages"
136,136,136,https://www.zomato.com/bangalore/suku-japanese-and-thai-restaurant-hsr-bangalore,Suku Japanese And Thai Restaurant,4.7,₹800 for two,japanese thai sushi salad desserts beverages,hsr,owner elaborate menu food presentation ambience flavour hospitality friendly head,HSR,"Japanese, Thai, Sushi, Salad, Desserts, Beverages"
137,137,137,https://www.zomato.com/bangalore/abs-absolute-barbecues-marathahalli,AB's - Absolute Barbecues,4.5,"₹1,850 for two",biryani bbq kebab north indian desserts,marathahalli,courteous waiters everything good live grill good food good service excellent variety complimentary drinks,Marathahalli,"Biryani, BBQ, Kebab, North Indian, Desserts"
138,138,138,https://www.zomato.com/bangalore/north-star-cafe-hsr-bangalore,North Star Cafe,4.2,₹800 for two,cafe bakery beverages desserts continental healthy food,hsr,portion size food quality value money packaging eco friendly great service,HSR,"Cafe, Bakery, Beverages, Desserts, Continental, Healthy Food"
139,139,139,https://www.zomato.com/bangalore/shelby-rooftop-taproom-kitchen-nagarbhavi-bangalore,Shelby Rooftop Taproom & Kitchen,4.2,"₹1,400 for two",asian north indian,nagarbhavi, shelby rooftop rooftop taproom experience rooftop,Nagarbhavi,"Asian, North Indian"
140,140,140,https://www.zomato.com/bangalore/pincode-24-bar-bistro-hebbal-bangalore,Pincode 24 Bar & Bistro,New,"₹1,000 for two",bar food continental north indian burger sandwich panini beverages,hebbal, excellent music,Hebbal,"Bar Food, Continental, North Indian, Burger, Sandwich, Panini, Beverages"
141,141,141,https://www.zomato.com/bangalore/hangover-brewery-koramangala-7th-block-bangalore,Hangover Brewery,4.0,"₹2,000 for two",continental north indian chinese finger food burger pizza desserts,koramangala,value money food ambience lovely staff polite ambiance music good food good service variety pizza ambience good service good music good feel ambience,Koramangala,"Continental, North Indian, Chinese, Finger Food, Burger, Pizza, Desserts"
142,142,142,https://www.zomato.com/bangalore/the-irish-house-bellandur,The Irish House,4.2,"₹2,000 for two",european american italian bbq beverages desserts,bellandur,wooden interiors ambience service lunch menu personal attention happy hour outside seating outdoor arrangement indoor outdoor fascination ambience,Bellandur,"European, American, Italian, BBQ, Beverages, Desserts"
143,143,143,https://www.zomato.com/bangalore/gatsby-bannerghatta-road-bangalore,Gatsby,4.4,"₹2,500 for two",finger food healthy food north indian asian sushi chinese south indian pizza,bannerghatta,excellent food service variety pizza amazing vibe outdoor seating great vibe huge place good service service ambience,Bannerghatta,"Finger Food, Healthy Food, North Indian, Asian, Sushi, Chinese, South Indian, Pizza"
144,144,144,https://www.zomato.com/bangalore/the-13th-floor-mg-road-bangalore,The 13th Floor,4.3,"₹2,500 for two",north indian asian kebab chinese salad beverages desserts,ashoknagar,breathtaking view sunset view fantastic view best rooftop magnificent view romantic ambience romantic best ambience good view ambience,Ashok Nagar,"North Indian, Asian, Kebab, Chinese, Salad, Beverages, Desserts"
145,145,145,https://www.zomato.com/bangalore/umbaa-pub-and-kitchen-1-itpl-main-road-whitefield-bangalore,Umbaa Pub And Kitchen,4.5,"₹1,500 for two",bar food north indian mughlai continental beverages,whitefield,dj vibe weekend brunch quick service good music decor pub kitchen umbaa pub umbaa rooftop rooftop pub,Whitefield,"Bar Food, North Indian, Mughlai, Continental, Beverages"
146,146,146,https://www.zomato.com/bangalore/21st-amendment-gastrobar-indiranagar-bangalore,21st Amendment Gastrobar,4.3,"₹1,700 for two",north indian fast food chinese bar food sichuan beverages,indiranagar,live sports streaming music good reasonably priced food tasty food overall ambience lovely good service good food good ambience service good friendly specially friendly staff friendly super,Indiranagar,"North Indian, Fast Food, Chinese, Bar Food, Sichuan, Beverages"
147,147,147,https://www.zomato.com/bangalore/foxtrot-marathahalli-bangalore,Foxtrot,4.2,"₹1,900 for two",north indian mughlai biryani desserts beverages,marathahalli,dj amazing dj music live band pretty place packed weekends live music ambience music ambience great,Marathahalli,"North Indian, Mughlai, Biryani, Desserts, Beverages"
148,148,148,https://www.zomato.com/bangalore/public-the-rooftop-bar-and-kitchen-bannerghatta-road-bangalore,Public - The Rooftop Bar And Kitchen,4.1,"₹1,200 for two",north indian biryani oriental pizza continental,bannerghatta,live music performance pool table singer live band good food service rooftop ambience good music girl family,Bannerghatta,"North Indian, Biryani, Oriental, Pizza, Continental"
149,149,149,https://www.zomato.com/bangalore/garden-city-beer-collective-yelahanka-bangalore,Garden City Beer Collective,4.3,"₹2,000 for two",pizza continental sushi asian south indian pasta desserts,yelahanka,amazing ambience ambience super cool beautiful place host elaborate menu vibe group family friendly huge friends family friendly gcbc fine dining,Yelahanka,"Pizza, Continental, Sushi, Asian, South Indian, Pasta, Desserts"
150,150,150,https://www.zomato.com/bangalore/masala-mandi-sarjapur-road-bangalore,Masala Mandi,4.3,"₹1,800 for two",north indian bbq biryani desserts beverages mughlai,sarjapur,royal ambience variety selection buffet variety quality good food good service ambience nice service quality food ,Sarjapur,"North Indian, BBQ, Biryani, Desserts, Beverages, Mughlai"
151,151,151,https://www.zomato.com/bangalore/salt-indian-restaurant-bar-grill-koramangala-7th-block-bangalore,Salt - Indian Restaurant Bar & Grill,4.7,"₹1,800 for two",north indian rolls mughlai seafood biryani kebab desserts beverages,koramangala,amazing food amazing price comfortable seating family place fantastic service great host wonderful service fine dining great family,Koramangala,"North Indian, Rolls, Mughlai, Seafood, Biryani, Kebab, Desserts, Beverages"
152,152,152,https://www.zomato.com/bangalore/big-pitcher-sarjapur-road-bangalore,Big Pitcher,4.5,"₹1,800 for two",north indian continental mughlai chinese italian biryani desserts beverages,sarjapur,variety selection good service good quality ambiance music customizable dishes great services good server ,Sarjapur,"North Indian, Continental, Mughlai, Chinese, Italian, Biryani, Desserts, Beverages"
153,153,153,https://www.zomato.com/bangalore/the-big-barbeque-marathahalli-bangalore,The Big Barbeque,4.4,"₹2,000 for two",bbq pizza north indian pasta desserts beverages,marathahalli,variety selection buffet variety quality good services good people courteous waiters food service bottomless brunch beautiful ambience,Marathahalli,"BBQ, Pizza, North Indian, Pasta, Desserts, Beverages"
154,154,154,https://www.zomato.com/bangalore/elysium-by-stories-sarjapur-road-bangalore,Elysium By Stories,4.3,"₹1,600 for two",south indian north indian fast food oriental,sarjapur,rooftop hookah view host great service good music service ambience ambience nice good service,Sarjapur,"South Indian, North Indian, Fast Food, Oriental"
155,155,155,https://www.zomato.com/bangalore/stories-bar-kitchen-jp-nagar-bangalore,Stories Bar & Kitchen,4.3,"₹1,800 for two",bar food chinese north indian italian pizza seafood desserts,jpnagar,intimate seating rooftop ambience valet service nice cozy place quality food good server service good friendly staff good ambience amazing ambience great service frill ambience friendly service,JP Nagar,"Bar Food, Chinese, North Indian, Italian, Pizza, Seafood, Desserts"
156,156,156,https://www.zomato.com/bangalore/peepai-3-hebbal-bangalore,Peepai,4.5,"₹2,500 for two",north indian pizza chinese european bar food biryani desserts beverages,hebbal,variety pizza cashless payments affordable affordable inexpensive great vibe nice hospitality service great service good good service good ambience great service,Hebbal,"North Indian, Pizza, Chinese, European, Bar Food, Biryani, Desserts, Beverages"
157,157,157,https://www.zomato.com/bangalore/homiga-brigade-road-bangalore,Homiga,4.1,"₹1,500 for two",korean asian,ashoknagar, price ambience,Ashok Nagar,"Korean, Asian"
158,158,158,https://www.zomato.com/bangalore/cha-cha-cha-dimsum-sushi-stir-fry-whitefield-bangalore,"Cha Cha Cha - Dimsum, Sushi, Stir Fry",4.2,"₹2,500 for two",asian chinese,whitefield,service great fast great host wonderful place weekend brunch server amazing service extremely ambience,Whitefield,"Asian, Chinese"
159,159,159,https://www.zomato.com/bangalore/bistro-claytopia-koramangala-1st-block,Bistro Claytopia,3.7,"₹1,100 for two",cafe american italian modern indian continental desserts beverages,koramangala,kids friendly nice outdoor seating outdoor ambience romantic place soothing ambience menu options friendly especially cute ambience cozy romantic,Koramangala,"Cafe, American, Italian, Modern Indian, Continental, Desserts, Beverages"
160,160,160,https://www.zomato.com/bangalore/fennys-lounge-and-kitchen-koramangala-7th-block,Fenny's Lounge And Kitchen,4.5,"₹1,900 for two",mediterranean continental italian desserts beverages,koramangala,affordable rate great food great service rooftop lounge music playlist great hangout place drink options open area seating great ambience good service good friendly friendly madhu friendly staff,Koramangala,"Mediterranean, Continental, Italian, Desserts, Beverages"
161,161,161,https://www.zomato.com/bangalore/the-hole-in-the-wall-cafe-koramangala-4th-block-bangalore,The Hole In The Wall Cafe,4.4,₹700 for two,cafe continental burger sandwich shake beverages desserts,koramangala,breakfast joint worth waiting beautiful cafe nice cozy place simple decor cosy ambience staff friendly love ambience ambience vibe evening ambience,Koramangala,"Cafe, Continental, Burger, Sandwich, Shake, Beverages, Desserts"
162,162,162,https://www.zomato.com/bangalore/windmills-1-whitefield-bangalore,Windmills,4.8,"₹3,500 for two",continental north indian mughlai kebab desserts,whitefield,live jazz sophisticated ambience live performances comfortable couches classy decor wooden interiors family couple,Whitefield,"Continental, North Indian, Mughlai, Kebab, Desserts"
163,163,163,https://www.zomato.com/bangalore/bombay-adda-koramangala-7th-block-bangalore,Bombay Adda,4.2,"₹2,000 for two",continental north indian asian pizza fast food kebab desserts beverages,koramangala,ambience awesome food tastes good bollywood nights best club dj amazing best dance place love ambience great music,Koramangala,"Continental, North Indian, Asian, Pizza, Fast Food, Kebab, Desserts, Beverages"
164,164,164,https://www.zomato.com/bangalore/la-casa-brewery-and-kitchen-sarjapur-road-bangalore,La Casa Brewery And Kitchen,4.3,"₹2,000 for two",continental north indian mughlai chinese finger food steak desserts beverages,sarjapur,everything good cozy ambience super ambience deck great host professional staff ambience good experience ambience exelends service extraordinary service,Sarjapur,"Continental, North Indian, Mughlai, Chinese, Finger Food, Steak, Desserts, Beverages"
165,165,165,https://www.zomato.com/bangalore/153-biere-street-whitefield-bangalore,153 Biere Street,4.2,"₹2,000 for two",asian continental north indian malaysian italian desserts,whitefield,open seating area outdoor ambience outdoor seating arrangement outdoor sitting best ambience great atmosphere excellent service service good nice ambience friendly staff ambience pleasant good service,Whitefield,"Asian, Continental, North Indian, Malaysian, Italian, Desserts"
166,166,166,https://www.zomato.com/bangalore/ouro-brigade-road-bangalore,Ouro,New,"₹3,000 for two",european mexican desserts,ashoknagar, service great ambience thank great service,Ashok Nagar,"European, Mexican, Desserts"
167,167,167,https://www.zomato.com/bangalore/aromas-of-biryani-1-jayanagar-bangalore,Aromas Of Biryani,4.3,"₹1,000 for two",biryani north indian south indian,jayanagar,food packaging boneless chicken biryani comfort food excellent taste good wifi preparation wonderful ambience,Jayanagar,"Biryani, North Indian, South Indian"
168,168,168,https://www.zomato.com/bangalore/dishkeyaun-1-brigade-road-bangalore,Dishkeyaun,4.0,"₹2,000 for two",modern indian biryani desserts,ashoknagar, spacious dj service add fab ambience amazing service ambience moment,Ashok Nagar,"Modern Indian, Biryani, Desserts"
169,169,169,https://www.zomato.com/bangalore/asia-alive-doubletree-suites-by-hilton-sarjapur-road-bangalore,Asia Alive - DoubleTree Suites By Hilton,3.9,"₹3,500 for two",north indian south indian chinese thai italian burger sandwich beverages,sarjapur,sophisticated worth price servings brunch live music good options office dance family inclusive,Sarjapur,"North Indian, South Indian, Chinese, Thai, Italian, Burger, Sandwich, Beverages"
170,170,170,https://www.zomato.com/bangalore/spettacolare-indiranagar-bangalore,Spettacolare,3.9,"₹1,000 for two",italian pizza pasta,indiranagar,ambiance staff experience taste good ambience ambience good family good family shortcoming fantastic service,Indiranagar,"Italian, Pizza, Pasta"
171,171,171,https://www.zomato.com/bangalore/dyu-art-cafe-koramangala-8th-block-bangalore,Dyu Art Cafe,4.3,₹850 for two,cafe continental burger sandwich pizza fast food desserts beverages,koramangala,artistic ambience homely ambience bookshelf beautiful cafe wooden interiors serene ambience affordable ambience,Koramangala,"Cafe, Continental, Burger, Sandwich, Pizza, Fast Food, Desserts, Beverages"
172,172,172,https://www.zomato.com/bangalore/khmer-kitchen-jp-nagar-bangalore,Khmer Kitchen,4.6,"₹2,500 for two",chinese asian thai japanese,jpnagar,ambience best casual dress code ambience delightful authentic service great fast nice crowd space family beautiful ambience ambience beautiful exquisite ambience,JP Nagar,"Chinese, Asian, Thai, Japanese"
173,173,173,https://www.zomato.com/bangalore/aromas-hyderabad-house-marathahalli-bangalore,Aroma's Hyderabad House,4.2,₹950 for two,hyderabadi biryani north indian mughlai chinese seafood kebab beverages,marathahalli,weekend brunch good music family crowd good wifi elaborate menu customizable food ,Marathahalli,"Hyderabadi, Biryani, North Indian, Mughlai, Chinese, Seafood, Kebab, Beverages"
174,174,174,https://www.zomato.com/bangalore/kathpals-bannerghatta-road-bangalore,Kathpal's,4.3,"₹1,000 for two",north indian chinese biryani street food desserts beverages,bannerghatta,appetizers beautiful ambience staff behaviour interior elaborate menu weekend brunch good service nice ambience,Bannerghatta,"North Indian, Chinese, Biryani, Street Food, Desserts, Beverages"
175,175,175,https://www.zomato.com/bangalore/the-peak-2-sahakara-nagar-bangalore,The Peak,4.3,"₹1,000 for two",continental mangalorean,sahakaranagar,best view seating great place great food ambiance staff good service,Sahakara Nagar,"Continental, Mangalorean"
176,176,176,https://www.zomato.com/bangalore/lord-of-the-drinks-1-whitefield-bangalore,Lord Of The Drinks,4.0,"₹1,700 for two",finger food continental european north indian italian asian sichuan,whitefield,music feel good music beautiful ambiance music ambience good food good service service great fast ambience super cool beautiful ambience ambience dj finger ambience,Whitefield,"Finger Food, Continental, European, North Indian, Italian, Asian, Sichuan"
177,177,177,https://www.zomato.com/bangalore/blink-by-zoca-whitefield-bangalore,Blink by Zoca,3.9,"₹1,500 for two",north indian chinese thai continental,whitefield, ambience great service ambience great ambience good service amazing service ambience nominal,Whitefield,"North Indian, Chinese, Thai, Continental"
178,178,178,https://www.zomato.com/bangalore/thelagram-jp-nagar-bangalore,Thelagram,New,₹800 for two,north indian street food desserts beverages,jpnagar, ambience lively,JP Nagar,"North Indian, Street Food, Desserts, Beverages"
179,179,179,https://www.zomato.com/ArborBrewIndia,Arbor Brewing Company,4.6,"₹1,800 for two",american continental fast food beverages,brigaderoad,large place classy ambience wooden interiors brilliant ambience rock music outdoor sitting favourite pub ambience good service perfect end service,Brigade Road,"American, Continental, Fast Food, Beverages"
180,180,180,https://www.zomato.com/bangalore/toscano-varthur-main-road-whitefield-bangalore,Toscano,4.6,"₹1,800 for two",italian pizza pasta continental desserts steak seafood beverages,whitefield,comfortable seating area live music authenticity variety outdoor seating courteous staff live music friendly helpful family love,Whitefield,"Italian, Pizza, Pasta, Continental, Desserts, Steak, Seafood, Beverages"
181,181,181,https://www.zomato.com/bangalore/paragon-restaurant-since-1939-st-marks-road-bangalore,Paragon Restaurant - Since 1939,4.0,"₹1,000 for two",kerala oriental south indian chinese seafood desserts beverages,ashoknagar, great friendly great service friendly service,Ashok Nagar,"Kerala, Oriental, South Indian, Chinese, Seafood, Desserts, Beverages"
182,182,182,https://www.zomato.com/bangalore/sstella-asian-kitchen-and-bar-bannerghatta-road-bangalore,Sstella Asian Kitchen And Bar,4.5,"₹1,000 for two",asian chinese desserts beverages,bannerghatta,decor ambience music good service staff experience great ambience beautiful ambience good cocktails family great,Bannerghatta,"Asian, Chinese, Desserts, Beverages"
183,183,183,https://www.zomato.com/bangalore/shiro-lavelle-road,Shiro,4.1,"₹3,500 for two",japanese sushi asian desserts thai korean cantonese vietnamese,ashoknagar,flavorful entrees modern vibe customizable intimate setting extensive food menu sophisticated great service fine dining friendly welcome friendly click,Ashok Nagar,"Japanese, Sushi, Asian, Desserts, Thai, Korean, Cantonese, Vietnamese"
184,184,184,https://www.zomato.com/bangalore/vapour-brewpub-and-diner-sarjapur-road-bangalore,Vapour Brewpub And Diner,4.3,"₹2,200 for two",north indian continental italian european biryani salad desserts beverages,sarjapur,good rooftop ambience friendly behavior rooftop view good food good service amazing view awesome view good service good hangout friendly happy,Sarjapur,"North Indian, Continental, Italian, European, Biryani, Salad, Desserts, Beverages"
185,185,185,https://www.zomato.com/bangalore/154-breakfast-club-koramangala-4th-block-bangalore,154 Breakfast Club,3.9,"₹1,100 for two",burger cafe sandwich street food fast food pancake asian desserts,koramangala,breakfast joint quaint little place brunch decent service cleanliness good menu ,Koramangala,"Burger, Cafe, Sandwich, Street Food, Fast Food, Pancake, Asian, Desserts"
186,186,186,https://www.zomato.com/bangalore/1522-the-pub-jp-nagar-bangalore,1522 - The Pub,4.4,"₹1,800 for two",chinese north indian mughlai finger food seafood,jpnagar,affordable menu service quality food ambience nice service great steward good staff hangout typical hangout keerthan great service great ambience good service good affordable,JP Nagar,"Chinese, North Indian, Mughlai, Finger Food, Seafood"
187,187,187,https://www.zomato.com/bangalore/we-neighborhood-brigade-road-bangalore,We: Neighborhood,4.4,"₹1,400 for two",european american north indian burger pizza desserts beverages,brigaderoad,bottomless brunch lovely service perfect service good server outstanding service great services service good amazing ambience service christopher good ambience friendly ambience good music good service,Brigade Road,"European, American, North Indian, Burger, Pizza, Desserts, Beverages"
188,188,188,https://www.zomato.com/bangalore/district-6-pub-brewery-kitchen-malleshwaram-bangalore,District 6 Pub Brewery & Kitchen,4.5,"₹2,500 for two",north indian pizza italian bar food continental asian desserts,malleshwaram,sanitised service pub counter excellent location great recommendations nice concept clean hygienic place hang family,Malleshwaram,"North Indian, Pizza, Italian, Bar Food, Continental, Asian, Desserts"
189,189,189,https://www.zomato.com/bangalore/the-fishermans-wharf-sarjapur-road,The Fisherman's Wharf,4.1,"₹1,900 for two",north indian chinese seafood goan finger food continental desserts beverages,sarjapur,play area impressive ambience live band attentive service live performances singer friendly extensive,Sarjapur,"North Indian, Chinese, Seafood, Goan, Finger Food, Continental, Desserts, Beverages"
190,190,190,https://www.zomato.com/bangalore/torye-drink-dine-dance-rajarajeshwari-nagar-bangalore,"Torye Drink, Dine & Dance",3.8,"₹2,000 for two",continental,rajarajeshwarinagar, ,Rajarajeshwari Nagar,Continental
191,191,191,https://www.zomato.com/bangalore/big-barrel-brewpub-rajarajeshwari-nagar-bangalore,Big Barrel BrewPub,4.3,"₹2,000 for two",chinese salad north indian oriental mexican italian continental beverages,rajarajeshwarinagar,welcoming smiles place good best staff great menu affordable outdoor seating nice ambience beer ambience rooftop brewery nice hangout ambience perfect ambience nice ambience amazing,Rajarajeshwari Nagar,"Chinese, Salad, North Indian, Oriental, Mexican, Italian, Continental, Beverages"
192,192,192,https://www.zomato.com/bangalore/babylonia-global-food-cocktails-koramangala-7th-block-bangalore,Babylonia - Global Food & Cocktails,4.6,"₹1,500 for two",continental north indian asian italian mughlai mediterranean bar food desserts,koramangala,dance floor variety pizza great music rooftop great hospitality amazing service ambience service ambience great indoor outdoor good service good music great ambience,Koramangala,"Continental, North Indian, Asian, Italian, Mughlai, Mediterranean, Bar Food, Desserts"
193,193,193,https://www.zomato.com/bangalore/bhola-blonde-indiranagar-bangalore,Bhola & Blonde,4.0,"₹1,900 for two",north indian lucknowi mughlai biryani fast food desserts,indiranagar,good music beautiful ambiance staff behaviour excellent music ambience professional service live music best services live music,Indiranagar,"North Indian, Lucknowi, Mughlai, Biryani, Fast Food, Desserts"
194,194,194,https://www.zomato.com/bangalore/monks-bar-social-1-btm-bangalore,Monk's Bar & Social,4.5,"₹1,000 for two",bar food south indian asian european italian north indian desserts beverages,btm,ambience great service good food experience live music hangout family affordable great service,BTM,"Bar Food, South Indian, Asian, European, Italian, North Indian, Desserts, Beverages"
195,195,195,https://www.zomato.com/bangalore/sector-144-electronic-city-bangalore,Sector 144,4.4,"₹1,100 for two",north indian chinese kebab mughlai italian fast food desserts bar food,electroniccity,elaborate menu ambiance fresh food good quality staff date night feedback dj fancy pub,Electronic City,"North Indian, Chinese, Kebab, Mughlai, Italian, Fast Food, Desserts, Bar Food"
196,196,196,https://www.zomato.com/bangalore/conçu-indiranagar-bangalore,Conçu,4.4,₹500 for two,cafe fast food,indiranagar,cafe staff value money taste ,Indiranagar,"Cafe, Fast Food"
